{
  "schema_version": "1.0",
  "run_id": "Q001",
  "problem_id": "Q001",
  "current_phase": "16",
  "last_completed_boundary": "16",
  "next_action": "none \u2014 run complete",
  "status": "completed",
  "pending_human_approvals": [],
  "budget_snapshot": {
    "wall_clock_seconds": 5400,
    "api_cost_usd": 8.2,
    "pivot_count": 0,
    "ba_rounds_used": 0
  },
  "updated_at": "2026-08-09T01:30:00Z"
}
